{
  "schema": "hexroute.access-regression.v1",
  "name": "gitlab-https",
  "input": {
    "normal_codex": "not_applicable",
    "twilight_socks": "healthy",
    "twilight_doh": "healthy",
    "target": "gitlab.corp.example",
    "current_route": "other_tun",
    "pritunl_state": "not_applicable",
    "pritunl_client_address": false,
    "inner_probe": "not_applicable"
  },
  "expected": {
    "route_action": "repair_twilight_scoped",
    "route_owner": "twilight_tun",
    "chatgpt_proxy": "unchanged",
    "system_proxy_change": false,
    "adguard_action": "none",
    "pritunl_outer_ready": false,
    "pritunl_connected": false,
    "pritunl_reconnect": false
  }
}
