{
  "schema": "hexroute.access-regression.v1",
  "name": "chatgpt-chromium-isolation",
  "input": {
    "normal_codex": "healthy",
    "twilight_socks": "healthy",
    "twilight_doh": "healthy",
    "target": "chatgpt.openai.example",
    "current_route": "physical",
    "pritunl_state": "not_applicable",
    "pritunl_client_address": false,
    "inner_probe": "not_applicable"
  },
  "expected": {
    "route_action": "none",
    "route_owner": "unchanged",
    "chatgpt_proxy": "launch_twilight_isolated",
    "system_proxy_change": false,
    "adguard_action": "none",
    "pritunl_outer_ready": false,
    "pritunl_connected": false,
    "pritunl_reconnect": false
  }
}
